{
 "format": "2.0",
 "id": "RECIPES/Jab_With_Hit",
 "name": "Jab With Hit",
 "tags": [
  "attack",
  "unarmed"
 ],
 "desc": "A jab with a hit event where the fist lands",
 "steps": [
  {
   "as": "jab",
   "op": "clip",
   "id": "MESH2MOTION/Punch_Jab"
  },
  {
   "op": "events",
   "in": "jab",
   "add": [
    {
     "t": 0.3,
     "name": "hit"
    }
   ]
  }
 ]
}
